[{"cancellation":{"allowedDuring":["startup","recovery"],"cooldown":"retain","refund":"reserved"},"capturedStatIds":["fixture:power"],"contentVersion":"0.1.0","cooldown":{"durationTicks":12,"startsOn":"active"},"costs":[{"amount":10,"resourceId":"fixture:mana","settlement":"reserve"}],"effects":[{"amount":1,"kind":"modify-resource","recipient":"source","resourceId":"fixture:mana"},{"abilityId":"fixture:ability-contract-child","kind":"trigger-ability"}],"id":"fixture:ability-contract","kind":"ability-definition","schemaVersion":"1.0.0","statPolicy":"snapshot","tags":["fixture:ability"],"targeting":{"mode":"self","range":0},"timing":{"activeTicks":1,"recoveryTicks":3,"startupTicks":2}},{"cancellation":{"allowedDuring":[],"cooldown":"retain","refund":"none"},"capturedStatIds":[],"contentVersion":"0.1.0","cooldown":{"durationTicks":0,"startsOn":"complete"},"costs":[],"effects":[],"id":"fixture:ability-contract-child","kind":"ability-definition","schemaVersion":"1.0.0","statPolicy":"live","tags":["fixture:ability"],"targeting":{"mode":"self","range":0},"timing":{"activeTicks":0,"recoveryTicks":0,"startupTicks":0}}]
